{
  "id": "evt-example-001",
  "kind": "day_plan_generated",
  "visibility": "public",
  "summary": "Daily swarm plan generated with balanced Career/Systems focus and protected presence blocks.",
  "created_at": "2026-07-12T10:00:00.000Z",
  "areas": ["Career", "Systems", "Relationships", "Health"],
  "refs": ["public/persona/projection.json", "ensembly-swarm"]
}
